No.     Time           Source                Destination           Protocol Length Info
    167 9.792080       192.168.1.123         192.168.1.168         TCP      78     65436 → 8080 [SYN] Seq=0 Win=65535 Len=0 MSS=1460 WS=16 TSval=2318190636 TSecr=0 SACK_PERM

Frame 167: 78 bytes on wire (624 bits), 78 bytes captured (624 bits) on interface en0, id 0
Ethernet II, Src: 52:0e:3d:58:d8:31 (52:0e:3d:58:d8:31), Dst: Espressif_95:b9:d0 (74:4d:bd:95:b9:d0)
Internet Protocol Version 4, Src: 192.168.1.123, Dst: 192.168.1.168
Transmission Control Protocol, Src Port: 65436, Dst Port: 8080, Seq: 0, Len: 0

No.     Time           Source                Destination           Protocol Length Info
    170 9.932464       192.168.1.168         192.168.1.123         TCP      58     8080 → 65436 [SYN, ACK] Seq=0 Ack=1 Win=5760 Len=0 MSS=1440

Frame 170: 58 bytes on wire (464 bits), 58 bytes captured (464 bits) on interface en0, id 0
Ethernet II, Src: Espressif_95:b9:d0 (74:4d:bd:95:b9:d0), Dst: 52:0e:3d:58:d8:31 (52:0e:3d:58:d8:31)
Internet Protocol Version 4, Src: 192.168.1.168, Dst: 192.168.1.123
Transmission Control Protocol, Src Port: 8080, Dst Port: 65436, Seq: 0, Ack: 1, Len: 0

No.     Time           Source                Destination           Protocol Length Info
    171 9.932524       192.168.1.123         192.168.1.168         TCP      54     65436 → 8080 [ACK] Seq=1 Ack=1 Win=65535 Len=0

Frame 171: 54 bytes on wire (432 bits), 54 bytes captured (432 bits) on interface en0, id 0
Ethernet II, Src: 52:0e:3d:58:d8:31 (52:0e:3d:58:d8:31), Dst: Espressif_95:b9:d0 (74:4d:bd:95:b9:d0)
Internet Protocol Version 4, Src: 192.168.1.123, Dst: 192.168.1.168
Transmission Control Protocol, Src Port: 65436, Dst Port: 8080, Seq: 1, Ack: 1, Len: 0

No.     Time           Source                Destination           Protocol Length Info
    322 14.232172      192.168.1.168         192.168.1.123         TCP      58     8080 → 65436 [PSH, ACK] Seq=1 Ack=1 Win=5760 Len=4

Frame 322: 58 bytes on wire (464 bits), 58 bytes captured (464 bits) on interface en0, id 0
Ethernet II, Src: Espressif_95:b9:d0 (74:4d:bd:95:b9:d0), Dst: 52:0e:3d:58:d8:31 (52:0e:3d:58:d8:31)
Internet Protocol Version 4, Src: 192.168.1.168, Dst: 192.168.1.123
Transmission Control Protocol, Src Port: 8080, Dst Port: 65436, Seq: 1, Ack: 1, Len: 4

No.     Time           Source                Destination           Protocol Length Info
    323 14.232395      192.168.1.123         192.168.1.168         TCP      54     65436 → 8080 [ACK] Seq=1 Ack=5 Win=65535 Len=0

Frame 323: 54 bytes on wire (432 bits), 54 bytes captured (432 bits) on interface en0, id 0
Ethernet II, Src: 52:0e:3d:58:d8:31 (52:0e:3d:58:d8:31), Dst: Espressif_95:b9:d0 (74:4d:bd:95:b9:d0)
Internet Protocol Version 4, Src: 192.168.1.123, Dst: 192.168.1.168
Transmission Control Protocol, Src Port: 65436, Dst Port: 8080, Seq: 1, Ack: 5, Len: 0

No.     Time           Source                Destination           Protocol Length Info
    324 14.307164      192.168.1.168         192.168.1.123         TCP      1494   8080 → 65436 [PSH, ACK] Seq=5 Ack=1 Win=5760 Len=1440

Frame 324: 1494 bytes on wire (11952 bits), 1494 bytes captured (11952 bits) on interface en0, id 0
Ethernet II, Src: Espressif_95:b9:d0 (74:4d:bd:95:b9:d0), Dst: 52:0e:3d:58:d8:31 (52:0e:3d:58:d8:31)
Internet Protocol Version 4, Src: 192.168.1.168, Dst: 192.168.1.123
Transmission Control Protocol, Src Port: 8080, Dst Port: 65436, Seq: 5, Ack: 1, Len: 1440

No.     Time           Source                Destination           Protocol Length Info
    325 14.307348      192.168.1.123         192.168.1.168         TCP      54     65436 → 8080 [ACK] Seq=1 Ack=1445 Win=65535 Len=0

Frame 325: 54 bytes on wire (432 bits), 54 bytes captured (432 bits) on interface en0, id 0
Ethernet II, Src: 52:0e:3d:58:d8:31 (52:0e:3d:58:d8:31), Dst: Espressif_95:b9:d0 (74:4d:bd:95:b9:d0)
Internet Protocol Version 4, Src: 192.168.1.123, Dst: 192.168.1.168
Transmission Control Protocol, Src Port: 65436, Dst Port: 8080, Seq: 1, Ack: 1445, Len: 0

No.     Time           Source                Destination           Protocol Length Info
    326 14.428666      192.168.1.168         192.168.1.123         TCP      1494   [TCP Previous segment not captured] 8080 → 65436 [PSH, ACK] Seq=2885 Ack=1 Win=5760 Len=1440

Frame 326: 1494 bytes on wire (11952 bits), 1494 bytes captured (11952 bits) on interface en0, id 0
Ethernet II, Src: Espressif_95:b9:d0 (74:4d:bd:95:b9:d0), Dst: 52:0e:3d:58:d8:31 (52:0e:3d:58:d8:31)
Internet Protocol Version 4, Src: 192.168.1.168, Dst: 192.168.1.123
Transmission Control Protocol, Src Port: 8080, Dst Port: 65436, Seq: 2885, Ack: 1, Len: 1440

No.     Time           Source                Destination           Protocol Length Info
    327 14.428798      192.168.1.123         192.168.1.168         TCP      54     [TCP Dup ACK 325#1] 65436 → 8080 [ACK] Seq=1 Ack=1445 Win=65535 Len=0

Frame 327: 54 bytes on wire (432 bits), 54 bytes captured (432 bits) on interface en0, id 0
Ethernet II, Src: 52:0e:3d:58:d8:31 (52:0e:3d:58:d8:31), Dst: Espressif_95:b9:d0 (74:4d:bd:95:b9:d0)
Internet Protocol Version 4, Src: 192.168.1.123, Dst: 192.168.1.168
Transmission Control Protocol, Src Port: 65436, Dst Port: 8080, Seq: 1, Ack: 1445, Len: 0

No.     Time           Source                Destination           Protocol Length Info
    370 16.074870      192.168.1.168         192.168.1.123         TCP      1494   [TCP Retransmission] 8080 → 65436 [ACK] Seq=1445 Ack=1 Win=5760 Len=1440

Frame 370: 1494 bytes on wire (11952 bits), 1494 bytes captured (11952 bits) on interface en0, id 0
Ethernet II, Src: Espressif_95:b9:d0 (74:4d:bd:95:b9:d0), Dst: 52:0e:3d:58:d8:31 (52:0e:3d:58:d8:31)
Internet Protocol Version 4, Src: 192.168.1.168, Dst: 192.168.1.123
Transmission Control Protocol, Src Port: 8080, Dst Port: 65436, Seq: 1445, Ack: 1, Len: 1440

No.     Time           Source                Destination           Protocol Length Info
    371 16.075016      192.168.1.123         192.168.1.168         TCP      54     65436 → 8080 [ACK] Seq=1 Ack=4325 Win=65535 Len=0

Frame 371: 54 bytes on wire (432 bits), 54 bytes captured (432 bits) on interface en0, id 0
Ethernet II, Src: 52:0e:3d:58:d8:31 (52:0e:3d:58:d8:31), Dst: Espressif_95:b9:d0 (74:4d:bd:95:b9:d0)
Internet Protocol Version 4, Src: 192.168.1.123, Dst: 192.168.1.168
Transmission Control Protocol, Src Port: 65436, Dst Port: 8080, Seq: 1, Ack: 4325, Len: 0

No.     Time           Source                Destination           Protocol Length Info
    372 16.195200      192.168.1.168         192.168.1.123         TCP      1494   [TCP Previous segment not captured] 8080 → 65436 [PSH, ACK] Seq=5765 Ack=1 Win=5760 Len=1440

Frame 372: 1494 bytes on wire (11952 bits), 1494 bytes captured (11952 bits) on interface en0, id 0
Ethernet II, Src: Espressif_95:b9:d0 (74:4d:bd:95:b9:d0), Dst: 52:0e:3d:58:d8:31 (52:0e:3d:58:d8:31)
Internet Protocol Version 4, Src: 192.168.1.168, Dst: 192.168.1.123
Transmission Control Protocol, Src Port: 8080, Dst Port: 65436, Seq: 5765, Ack: 1, Len: 1440

No.     Time           Source                Destination           Protocol Length Info
    373 16.195357      192.168.1.123         192.168.1.168         TCP      54     [TCP Dup ACK 371#1] 65436 → 8080 [ACK] Seq=1 Ack=4325 Win=65535 Len=0

Frame 373: 54 bytes on wire (432 bits), 54 bytes captured (432 bits) on interface en0, id 0
Ethernet II, Src: 52:0e:3d:58:d8:31 (52:0e:3d:58:d8:31), Dst: Espressif_95:b9:d0 (74:4d:bd:95:b9:d0)
Internet Protocol Version 4, Src: 192.168.1.123, Dst: 192.168.1.168
Transmission Control Protocol, Src Port: 65436, Dst Port: 8080, Seq: 1, Ack: 4325, Len: 0

No.     Time           Source                Destination           Protocol Length Info
    407 26.543273      192.168.1.168         192.168.1.123         TCP      1494   [TCP Retransmission] 8080 → 65436 [ACK] Seq=4325 Ack=1 Win=5760 Len=1440

Frame 407: 1494 bytes on wire (11952 bits), 1494 bytes captured (11952 bits) on interface en0, id 0
Ethernet II, Src: Espressif_95:b9:d0 (74:4d:bd:95:b9:d0), Dst: 52:0e:3d:58:d8:31 (52:0e:3d:58:d8:31)
Internet Protocol Version 4, Src: 192.168.1.168, Dst: 192.168.1.123
Transmission Control Protocol, Src Port: 8080, Dst Port: 65436, Seq: 4325, Ack: 1, Len: 1440

No.     Time           Source                Destination           Protocol Length Info
    408 26.543455      192.168.1.123         192.168.1.168         TCP      54     65436 → 8080 [ACK] Seq=1 Ack=7205 Win=65535 Len=0

Frame 408: 54 bytes on wire (432 bits), 54 bytes captured (432 bits) on interface en0, id 0
Ethernet II, Src: 52:0e:3d:58:d8:31 (52:0e:3d:58:d8:31), Dst: Espressif_95:b9:d0 (74:4d:bd:95:b9:d0)
Internet Protocol Version 4, Src: 192.168.1.123, Dst: 192.168.1.168
Transmission Control Protocol, Src Port: 65436, Dst Port: 8080, Seq: 1, Ack: 7205, Len: 0

No.     Time           Source                Destination           Protocol Length Info
    415 26.996171      192.168.1.168         192.168.1.123         TCP      1494   8080 → 65436 [ACK] Seq=7205 Ack=1 Win=5760 Len=1440

Frame 415: 1494 bytes on wire (11952 bits), 1494 bytes captured (11952 bits) on interface en0, id 0
Ethernet II, Src: Espressif_95:b9:d0 (74:4d:bd:95:b9:d0), Dst: 52:0e:3d:58:d8:31 (52:0e:3d:58:d8:31)
Internet Protocol Version 4, Src: 192.168.1.168, Dst: 192.168.1.123
Transmission Control Protocol, Src Port: 8080, Dst Port: 65436, Seq: 7205, Ack: 1, Len: 1440

No.     Time           Source                Destination           Protocol Length Info
    416 26.996298      192.168.1.123         192.168.1.168         TCP      54     65436 → 8080 [ACK] Seq=1 Ack=8645 Win=65535 Len=0

Frame 416: 54 bytes on wire (432 bits), 54 bytes captured (432 bits) on interface en0, id 0
Ethernet II, Src: 52:0e:3d:58:d8:31 (52:0e:3d:58:d8:31), Dst: Espressif_95:b9:d0 (74:4d:bd:95:b9:d0)
Internet Protocol Version 4, Src: 192.168.1.123, Dst: 192.168.1.168
Transmission Control Protocol, Src Port: 65436, Dst Port: 8080, Seq: 1, Ack: 8645, Len: 0

No.     Time           Source                Destination           Protocol Length Info
    417 27.079510      192.168.1.168         192.168.1.123         TCP      1494   8080 → 65436 [ACK] Seq=8645 Ack=1 Win=5760 Len=1440

Frame 417: 1494 bytes on wire (11952 bits), 1494 bytes captured (11952 bits) on interface en0, id 0
Ethernet II, Src: Espressif_95:b9:d0 (74:4d:bd:95:b9:d0), Dst: 52:0e:3d:58:d8:31 (52:0e:3d:58:d8:31)
Internet Protocol Version 4, Src: 192.168.1.168, Dst: 192.168.1.123
Transmission Control Protocol, Src Port: 8080, Dst Port: 65436, Seq: 8645, Ack: 1, Len: 1440

No.     Time           Source                Destination           Protocol Length Info
    418 27.079690      192.168.1.123         192.168.1.168         TCP      54     65436 → 8080 [ACK] Seq=1 Ack=10085 Win=65535 Len=0

Frame 418: 54 bytes on wire (432 bits), 54 bytes captured (432 bits) on interface en0, id 0
Ethernet II, Src: 52:0e:3d:58:d8:31 (52:0e:3d:58:d8:31), Dst: Espressif_95:b9:d0 (74:4d:bd:95:b9:d0)
Internet Protocol Version 4, Src: 192.168.1.123, Dst: 192.168.1.168
Transmission Control Protocol, Src Port: 65436, Dst Port: 8080, Seq: 1, Ack: 10085, Len: 0

No.     Time           Source                Destination           Protocol Length Info
    419 27.160772      192.168.1.168         192.168.1.123         TCP      1494   8080 → 65436 [PSH, ACK] Seq=10085 Ack=1 Win=5760 Len=1440

Frame 419: 1494 bytes on wire (11952 bits), 1494 bytes captured (11952 bits) on interface en0, id 0
Ethernet II, Src: Espressif_95:b9:d0 (74:4d:bd:95:b9:d0), Dst: 52:0e:3d:58:d8:31 (52:0e:3d:58:d8:31)
Internet Protocol Version 4, Src: 192.168.1.168, Dst: 192.168.1.123
Transmission Control Protocol, Src Port: 8080, Dst Port: 65436, Seq: 10085, Ack: 1, Len: 1440

No.     Time           Source                Destination           Protocol Length Info
    420 27.160948      192.168.1.123         192.168.1.168         TCP      54     65436 → 8080 [ACK] Seq=1 Ack=11525 Win=65535 Len=0

Frame 420: 54 bytes on wire (432 bits), 54 bytes captured (432 bits) on interface en0, id 0
Ethernet II, Src: 52:0e:3d:58:d8:31 (52:0e:3d:58:d8:31), Dst: Espressif_95:b9:d0 (74:4d:bd:95:b9:d0)
Internet Protocol Version 4, Src: 192.168.1.123, Dst: 192.168.1.168
Transmission Control Protocol, Src Port: 65436, Dst Port: 8080, Seq: 1, Ack: 11525, Len: 0

No.     Time           Source                Destination           Protocol Length Info
    421 27.208464      192.168.1.168         192.168.1.123         TCP      1494   8080 → 65436 [ACK] Seq=11525 Ack=1 Win=5760 Len=1440

Frame 421: 1494 bytes on wire (11952 bits), 1494 bytes captured (11952 bits) on interface en0, id 0
Ethernet II, Src: Espressif_95:b9:d0 (74:4d:bd:95:b9:d0), Dst: 52:0e:3d:58:d8:31 (52:0e:3d:58:d8:31)
Internet Protocol Version 4, Src: 192.168.1.168, Dst: 192.168.1.123
Transmission Control Protocol, Src Port: 8080, Dst Port: 65436, Seq: 11525, Ack: 1, Len: 1440

No.     Time           Source                Destination           Protocol Length Info
    422 27.208658      192.168.1.123         192.168.1.168         TCP      54     65436 → 8080 [ACK] Seq=1 Ack=12965 Win=65535 Len=0

Frame 422: 54 bytes on wire (432 bits), 54 bytes captured (432 bits) on interface en0, id 0
Ethernet II, Src: 52:0e:3d:58:d8:31 (52:0e:3d:58:d8:31), Dst: Espressif_95:b9:d0 (74:4d:bd:95:b9:d0)
Internet Protocol Version 4, Src: 192.168.1.123, Dst: 192.168.1.168
Transmission Control Protocol, Src Port: 65436, Dst Port: 8080, Seq: 1, Ack: 12965, Len: 0

No.     Time           Source                Destination           Protocol Length Info
    423 27.315295      192.168.1.168         192.168.1.123         TCP      1494   8080 → 65436 [ACK] Seq=12965 Ack=1 Win=5760 Len=1440

Frame 423: 1494 bytes on wire (11952 bits), 1494 bytes captured (11952 bits) on interface en0, id 0
Ethernet II, Src: Espressif_95:b9:d0 (74:4d:bd:95:b9:d0), Dst: 52:0e:3d:58:d8:31 (52:0e:3d:58:d8:31)
Internet Protocol Version 4, Src: 192.168.1.168, Dst: 192.168.1.123
Transmission Control Protocol, Src Port: 8080, Dst Port: 65436, Seq: 12965, Ack: 1, Len: 1440

No.     Time           Source                Destination           Protocol Length Info
    424 27.315299      192.168.1.168         192.168.1.123         TCP      1494   8080 → 65436 [PSH, ACK] Seq=14405 Ack=1 Win=5760 Len=1440

Frame 424: 1494 bytes on wire (11952 bits), 1494 bytes captured (11952 bits) on interface en0, id 0
Ethernet II, Src: Espressif_95:b9:d0 (74:4d:bd:95:b9:d0), Dst: 52:0e:3d:58:d8:31 (52:0e:3d:58:d8:31)
Internet Protocol Version 4, Src: 192.168.1.168, Dst: 192.168.1.123
Transmission Control Protocol, Src Port: 8080, Dst Port: 65436, Seq: 14405, Ack: 1, Len: 1440

No.     Time           Source                Destination           Protocol Length Info
    425 27.315479      192.168.1.123         192.168.1.168         TCP      54     65436 → 8080 [ACK] Seq=1 Ack=15845 Win=65535 Len=0

Frame 425: 54 bytes on wire (432 bits), 54 bytes captured (432 bits) on interface en0, id 0
Ethernet II, Src: 52:0e:3d:58:d8:31 (52:0e:3d:58:d8:31), Dst: Espressif_95:b9:d0 (74:4d:bd:95:b9:d0)
Internet Protocol Version 4, Src: 192.168.1.123, Dst: 192.168.1.168
Transmission Control Protocol, Src Port: 65436, Dst Port: 8080, Seq: 1, Ack: 15845, Len: 0

No.     Time           Source                Destination           Protocol Length Info
    426 27.429037      192.168.1.168         192.168.1.123         TCP      1494   8080 → 65436 [ACK] Seq=15845 Ack=1 Win=5760 Len=1440

Frame 426: 1494 bytes on wire (11952 bits), 1494 bytes captured (11952 bits) on interface en0, id 0
Ethernet II, Src: Espressif_95:b9:d0 (74:4d:bd:95:b9:d0), Dst: 52:0e:3d:58:d8:31 (52:0e:3d:58:d8:31)
Internet Protocol Version 4, Src: 192.168.1.168, Dst: 192.168.1.123
Transmission Control Protocol, Src Port: 8080, Dst Port: 65436, Seq: 15845, Ack: 1, Len: 1440

No.     Time           Source                Destination           Protocol Length Info
    427 27.429202      192.168.1.123         192.168.1.168         TCP      54     65436 → 8080 [ACK] Seq=1 Ack=17285 Win=65535 Len=0

Frame 427: 54 bytes on wire (432 bits), 54 bytes captured (432 bits) on interface en0, id 0
Ethernet II, Src: 52:0e:3d:58:d8:31 (52:0e:3d:58:d8:31), Dst: Espressif_95:b9:d0 (74:4d:bd:95:b9:d0)
Internet Protocol Version 4, Src: 192.168.1.123, Dst: 192.168.1.168
Transmission Control Protocol, Src Port: 65436, Dst Port: 8080, Seq: 1, Ack: 17285, Len: 0

No.     Time           Source                Destination           Protocol Length Info
    428 27.458254      192.168.1.168         192.168.1.123         TCP      1494   8080 → 65436 [ACK] Seq=17285 Ack=1 Win=5760 Len=1440

Frame 428: 1494 bytes on wire (11952 bits), 1494 bytes captured (11952 bits) on interface en0, id 0
Ethernet II, Src: Espressif_95:b9:d0 (74:4d:bd:95:b9:d0), Dst: 52:0e:3d:58:d8:31 (52:0e:3d:58:d8:31)
Internet Protocol Version 4, Src: 192.168.1.168, Dst: 192.168.1.123
Transmission Control Protocol, Src Port: 8080, Dst Port: 65436, Seq: 17285, Ack: 1, Len: 1440

No.     Time           Source                Destination           Protocol Length Info
    429 27.458367      192.168.1.123         192.168.1.168         TCP      54     65436 → 8080 [ACK] Seq=1 Ack=18725 Win=65535 Len=0

Frame 429: 54 bytes on wire (432 bits), 54 bytes captured (432 bits) on interface en0, id 0
Ethernet II, Src: 52:0e:3d:58:d8:31 (52:0e:3d:58:d8:31), Dst: Espressif_95:b9:d0 (74:4d:bd:95:b9:d0)
Internet Protocol Version 4, Src: 192.168.1.123, Dst: 192.168.1.168
Transmission Control Protocol, Src Port: 65436, Dst Port: 8080, Seq: 1, Ack: 18725, Len: 0

No.     Time           Source                Destination           Protocol Length Info
    430 27.493922      192.168.1.168         192.168.1.123         TCP      1494   8080 → 65436 [PSH, ACK] Seq=18725 Ack=1 Win=5760 Len=1440

Frame 430: 1494 bytes on wire (11952 bits), 1494 bytes captured (11952 bits) on interface en0, id 0
Ethernet II, Src: Espressif_95:b9:d0 (74:4d:bd:95:b9:d0), Dst: 52:0e:3d:58:d8:31 (52:0e:3d:58:d8:31)
Internet Protocol Version 4, Src: 192.168.1.168, Dst: 192.168.1.123
Transmission Control Protocol, Src Port: 8080, Dst Port: 65436, Seq: 18725, Ack: 1, Len: 1440

No.     Time           Source                Destination           Protocol Length Info
    431 27.494105      192.168.1.123         192.168.1.168         TCP      54     65436 → 8080 [ACK] Seq=1 Ack=20165 Win=65535 Len=0

Frame 431: 54 bytes on wire (432 bits), 54 bytes captured (432 bits) on interface en0, id 0
Ethernet II, Src: 52:0e:3d:58:d8:31 (52:0e:3d:58:d8:31), Dst: Espressif_95:b9:d0 (74:4d:bd:95:b9:d0)
Internet Protocol Version 4, Src: 192.168.1.123, Dst: 192.168.1.168
Transmission Control Protocol, Src Port: 65436, Dst Port: 8080, Seq: 1, Ack: 20165, Len: 0

No.     Time           Source                Destination           Protocol Length Info
    432 27.495754      192.168.1.168         192.168.1.123         TCP      1494   8080 → 65436 [ACK] Seq=20165 Ack=1 Win=5760 Len=1440

Frame 432: 1494 bytes on wire (11952 bits), 1494 bytes captured (11952 bits) on interface en0, id 0
Ethernet II, Src: Espressif_95:b9:d0 (74:4d:bd:95:b9:d0), Dst: 52:0e:3d:58:d8:31 (52:0e:3d:58:d8:31)
Internet Protocol Version 4, Src: 192.168.1.168, Dst: 192.168.1.123
Transmission Control Protocol, Src Port: 8080, Dst Port: 65436, Seq: 20165, Ack: 1, Len: 1440

No.     Time           Source                Destination           Protocol Length Info
    433 27.495756      192.168.1.168         192.168.1.123         TCP      1494   8080 → 65436 [PSH, ACK] Seq=21605 Ack=1 Win=5760 Len=1440

Frame 433: 1494 bytes on wire (11952 bits), 1494 bytes captured (11952 bits) on interface en0, id 0
Ethernet II, Src: Espressif_95:b9:d0 (74:4d:bd:95:b9:d0), Dst: 52:0e:3d:58:d8:31 (52:0e:3d:58:d8:31)
Internet Protocol Version 4, Src: 192.168.1.168, Dst: 192.168.1.123
Transmission Control Protocol, Src Port: 8080, Dst Port: 65436, Seq: 21605, Ack: 1, Len: 1440

No.     Time           Source                Destination           Protocol Length Info
    434 27.495850      192.168.1.123         192.168.1.168         TCP      54     65436 → 8080 [ACK] Seq=1 Ack=23045 Win=65535 Len=0

Frame 434: 54 bytes on wire (432 bits), 54 bytes captured (432 bits) on interface en0, id 0
Ethernet II, Src: 52:0e:3d:58:d8:31 (52:0e:3d:58:d8:31), Dst: Espressif_95:b9:d0 (74:4d:bd:95:b9:d0)
Internet Protocol Version 4, Src: 192.168.1.123, Dst: 192.168.1.168
Transmission Control Protocol, Src Port: 65436, Dst Port: 8080, Seq: 1, Ack: 23045, Len: 0

No.     Time           Source                Destination           Protocol Length Info
    437 27.616280      192.168.1.168         192.168.1.123         TCP      1494   8080 → 65436 [ACK] Seq=23045 Ack=1 Win=5760 Len=1440

Frame 437: 1494 bytes on wire (11952 bits), 1494 bytes captured (11952 bits) on interface en0, id 0
Ethernet II, Src: Espressif_95:b9:d0 (74:4d:bd:95:b9:d0), Dst: 52:0e:3d:58:d8:31 (52:0e:3d:58:d8:31)
Internet Protocol Version 4, Src: 192.168.1.168, Dst: 192.168.1.123
Transmission Control Protocol, Src Port: 8080, Dst Port: 65436, Seq: 23045, Ack: 1, Len: 1440

No.     Time           Source                Destination           Protocol Length Info
    438 27.616393      192.168.1.123         192.168.1.168         TCP      54     65436 → 8080 [ACK] Seq=1 Ack=24485 Win=65535 Len=0

Frame 438: 54 bytes on wire (432 bits), 54 bytes captured (432 bits) on interface en0, id 0
Ethernet II, Src: 52:0e:3d:58:d8:31 (52:0e:3d:58:d8:31), Dst: Espressif_95:b9:d0 (74:4d:bd:95:b9:d0)
Internet Protocol Version 4, Src: 192.168.1.123, Dst: 192.168.1.168
Transmission Control Protocol, Src Port: 65436, Dst Port: 8080, Seq: 1, Ack: 24485, Len: 0

No.     Time           Source                Destination           Protocol Length Info
    439 27.662474      192.168.1.168         192.168.1.123         TCP      1494   8080 → 65436 [ACK] Seq=24485 Ack=1 Win=5760 Len=1440

Frame 439: 1494 bytes on wire (11952 bits), 1494 bytes captured (11952 bits) on interface en0, id 0
Ethernet II, Src: Espressif_95:b9:d0 (74:4d:bd:95:b9:d0), Dst: 52:0e:3d:58:d8:31 (52:0e:3d:58:d8:31)
Internet Protocol Version 4, Src: 192.168.1.168, Dst: 192.168.1.123
Transmission Control Protocol, Src Port: 8080, Dst Port: 65436, Seq: 24485, Ack: 1, Len: 1440

No.     Time           Source                Destination           Protocol Length Info
    440 27.662603      192.168.1.123         192.168.1.168         TCP      54     65436 → 8080 [ACK] Seq=1 Ack=25925 Win=65535 Len=0

Frame 440: 54 bytes on wire (432 bits), 54 bytes captured (432 bits) on interface en0, id 0
Ethernet II, Src: 52:0e:3d:58:d8:31 (52:0e:3d:58:d8:31), Dst: Espressif_95:b9:d0 (74:4d:bd:95:b9:d0)
Internet Protocol Version 4, Src: 192.168.1.123, Dst: 192.168.1.168
Transmission Control Protocol, Src Port: 65436, Dst Port: 8080, Seq: 1, Ack: 25925, Len: 0

No.     Time           Source                Destination           Protocol Length Info
    441 27.732992      192.168.1.168         192.168.1.123         TCP      1494   8080 → 65436 [PSH, ACK] Seq=25925 Ack=1 Win=5760 Len=1440

Frame 441: 1494 bytes on wire (11952 bits), 1494 bytes captured (11952 bits) on interface en0, id 0
Ethernet II, Src: Espressif_95:b9:d0 (74:4d:bd:95:b9:d0), Dst: 52:0e:3d:58:d8:31 (52:0e:3d:58:d8:31)
Internet Protocol Version 4, Src: 192.168.1.168, Dst: 192.168.1.123
Transmission Control Protocol, Src Port: 8080, Dst Port: 65436, Seq: 25925, Ack: 1, Len: 1440

No.     Time           Source                Destination           Protocol Length Info
    442 27.733130      192.168.1.123         192.168.1.168         TCP      54     65436 → 8080 [ACK] Seq=1 Ack=27365 Win=65535 Len=0

Frame 442: 54 bytes on wire (432 bits), 54 bytes captured (432 bits) on interface en0, id 0
Ethernet II, Src: 52:0e:3d:58:d8:31 (52:0e:3d:58:d8:31), Dst: Espressif_95:b9:d0 (74:4d:bd:95:b9:d0)
Internet Protocol Version 4, Src: 192.168.1.123, Dst: 192.168.1.168
Transmission Control Protocol, Src Port: 65436, Dst Port: 8080, Seq: 1, Ack: 27365, Len: 0

No.     Time           Source                Destination           Protocol Length Info
    443 27.775424      192.168.1.168         192.168.1.123         TCP      1494   8080 → 65436 [ACK] Seq=27365 Ack=1 Win=5760 Len=1440

Frame 443: 1494 bytes on wire (11952 bits), 1494 bytes captured (11952 bits) on interface en0, id 0
Ethernet II, Src: Espressif_95:b9:d0 (74:4d:bd:95:b9:d0), Dst: 52:0e:3d:58:d8:31 (52:0e:3d:58:d8:31)
Internet Protocol Version 4, Src: 192.168.1.168, Dst: 192.168.1.123
Transmission Control Protocol, Src Port: 8080, Dst Port: 65436, Seq: 27365, Ack: 1, Len: 1440

No.     Time           Source                Destination           Protocol Length Info
    444 27.775609      192.168.1.123         192.168.1.168         TCP      54     65436 → 8080 [ACK] Seq=1 Ack=28805 Win=65535 Len=0

Frame 444: 54 bytes on wire (432 bits), 54 bytes captured (432 bits) on interface en0, id 0
Ethernet II, Src: 52:0e:3d:58:d8:31 (52:0e:3d:58:d8:31), Dst: Espressif_95:b9:d0 (74:4d:bd:95:b9:d0)
Internet Protocol Version 4, Src: 192.168.1.123, Dst: 192.168.1.168
Transmission Control Protocol, Src Port: 65436, Dst Port: 8080, Seq: 1, Ack: 28805, Len: 0

No.     Time           Source                Destination           Protocol Length Info
    445 27.811880      192.168.1.168         192.168.1.123         TCP      1494   8080 → 65436 [ACK] Seq=28805 Ack=1 Win=5760 Len=1440

Frame 445: 1494 bytes on wire (11952 bits), 1494 bytes captured (11952 bits) on interface en0, id 0
Ethernet II, Src: Espressif_95:b9:d0 (74:4d:bd:95:b9:d0), Dst: 52:0e:3d:58:d8:31 (52:0e:3d:58:d8:31)
Internet Protocol Version 4, Src: 192.168.1.168, Dst: 192.168.1.123
Transmission Control Protocol, Src Port: 8080, Dst Port: 65436, Seq: 28805, Ack: 1, Len: 1440

No.     Time           Source                Destination           Protocol Length Info
    446 27.812047      192.168.1.123         192.168.1.168         TCP      54     65436 → 8080 [ACK] Seq=1 Ack=30245 Win=65535 Len=0

Frame 446: 54 bytes on wire (432 bits), 54 bytes captured (432 bits) on interface en0, id 0
Ethernet II, Src: 52:0e:3d:58:d8:31 (52:0e:3d:58:d8:31), Dst: Espressif_95:b9:d0 (74:4d:bd:95:b9:d0)
Internet Protocol Version 4, Src: 192.168.1.123, Dst: 192.168.1.168
Transmission Control Protocol, Src Port: 65436, Dst Port: 8080, Seq: 1, Ack: 30245, Len: 0

No.     Time           Source                Destination           Protocol Length Info
    447 27.855586      192.168.1.168         192.168.1.123         TCP      1494   8080 → 65436 [PSH, ACK] Seq=30245 Ack=1 Win=5760 Len=1440

Frame 447: 1494 bytes on wire (11952 bits), 1494 bytes captured (11952 bits) on interface en0, id 0
Ethernet II, Src: Espressif_95:b9:d0 (74:4d:bd:95:b9:d0), Dst: 52:0e:3d:58:d8:31 (52:0e:3d:58:d8:31)
Internet Protocol Version 4, Src: 192.168.1.168, Dst: 192.168.1.123
Transmission Control Protocol, Src Port: 8080, Dst Port: 65436, Seq: 30245, Ack: 1, Len: 1440

No.     Time           Source                Destination           Protocol Length Info
    448 27.855781      192.168.1.123         192.168.1.168         TCP      54     65436 → 8080 [ACK] Seq=1 Ack=31685 Win=65535 Len=0

Frame 448: 54 bytes on wire (432 bits), 54 bytes captured (432 bits) on interface en0, id 0
Ethernet II, Src: 52:0e:3d:58:d8:31 (52:0e:3d:58:d8:31), Dst: Espressif_95:b9:d0 (74:4d:bd:95:b9:d0)
Internet Protocol Version 4, Src: 192.168.1.123, Dst: 192.168.1.168
Transmission Control Protocol, Src Port: 65436, Dst Port: 8080, Seq: 1, Ack: 31685, Len: 0

No.     Time           Source                Destination           Protocol Length Info
    449 27.945087      192.168.1.168         192.168.1.123         TCP      1494   8080 → 65436 [ACK] Seq=31685 Ack=1 Win=5760 Len=1440

Frame 449: 1494 bytes on wire (11952 bits), 1494 bytes captured (11952 bits) on interface en0, id 0
Ethernet II, Src: Espressif_95:b9:d0 (74:4d:bd:95:b9:d0), Dst: 52:0e:3d:58:d8:31 (52:0e:3d:58:d8:31)
Internet Protocol Version 4, Src: 192.168.1.168, Dst: 192.168.1.123
Transmission Control Protocol, Src Port: 8080, Dst Port: 65436, Seq: 31685, Ack: 1, Len: 1440

No.     Time           Source                Destination           Protocol Length Info
    450 28.026178      192.168.1.168         192.168.1.123         TCP      1494   8080 → 65436 [ACK] Seq=33125 Ack=1 Win=5760 Len=1440

Frame 450: 1494 bytes on wire (11952 bits), 1494 bytes captured (11952 bits) on interface en0, id 0
Ethernet II, Src: Espressif_95:b9:d0 (74:4d:bd:95:b9:d0), Dst: 52:0e:3d:58:d8:31 (52:0e:3d:58:d8:31)
Internet Protocol Version 4, Src: 192.168.1.168, Dst: 192.168.1.123
Transmission Control Protocol, Src Port: 8080, Dst Port: 65436, Seq: 33125, Ack: 1, Len: 1440

No.     Time           Source                Destination           Protocol Length Info
    451 28.026312      192.168.1.123         192.168.1.168         TCP      54     65436 → 8080 [ACK] Seq=1 Ack=34565 Win=65535 Len=0

Frame 451: 54 bytes on wire (432 bits), 54 bytes captured (432 bits) on interface en0, id 0
Ethernet II, Src: 52:0e:3d:58:d8:31 (52:0e:3d:58:d8:31), Dst: Espressif_95:b9:d0 (74:4d:bd:95:b9:d0)
Internet Protocol Version 4, Src: 192.168.1.123, Dst: 192.168.1.168
Transmission Control Protocol, Src Port: 65436, Dst Port: 8080, Seq: 1, Ack: 34565, Len: 0

No.     Time           Source                Destination           Protocol Length Info
    452 28.098104      192.168.1.168         192.168.1.123         TCP      1494   8080 → 65436 [PSH, ACK] Seq=34565 Ack=1 Win=5760 Len=1440

Frame 452: 1494 bytes on wire (11952 bits), 1494 bytes captured (11952 bits) on interface en0, id 0
Ethernet II, Src: Espressif_95:b9:d0 (74:4d:bd:95:b9:d0), Dst: 52:0e:3d:58:d8:31 (52:0e:3d:58:d8:31)
Internet Protocol Version 4, Src: 192.168.1.168, Dst: 192.168.1.123
Transmission Control Protocol, Src Port: 8080, Dst Port: 65436, Seq: 34565, Ack: 1, Len: 1440

No.     Time           Source                Destination           Protocol Length Info
    453 28.099844      192.168.1.123         192.168.1.168         TCP      54     65436 → 8080 [ACK] Seq=1 Ack=36005 Win=65535 Len=0

Frame 453: 54 bytes on wire (432 bits), 54 bytes captured (432 bits) on interface en0, id 0
Ethernet II, Src: 52:0e:3d:58:d8:31 (52:0e:3d:58:d8:31), Dst: Espressif_95:b9:d0 (74:4d:bd:95:b9:d0)
Internet Protocol Version 4, Src: 192.168.1.123, Dst: 192.168.1.168
Transmission Control Protocol, Src Port: 65436, Dst Port: 8080, Seq: 1, Ack: 36005, Len: 0

No.     Time           Source                Destination           Protocol Length Info
    454 28.139798      192.168.1.168         192.168.1.123         TCP      1494   8080 → 65436 [ACK] Seq=36005 Ack=1 Win=5760 Len=1440

Frame 454: 1494 bytes on wire (11952 bits), 1494 bytes captured (11952 bits) on interface en0, id 0
Ethernet II, Src: Espressif_95:b9:d0 (74:4d:bd:95:b9:d0), Dst: 52:0e:3d:58:d8:31 (52:0e:3d:58:d8:31)
Internet Protocol Version 4, Src: 192.168.1.168, Dst: 192.168.1.123
Transmission Control Protocol, Src Port: 8080, Dst Port: 65436, Seq: 36005, Ack: 1, Len: 1440

No.     Time           Source                Destination           Protocol Length Info
    455 28.239708      192.168.1.123         192.168.1.168         TCP      54     65436 → 8080 [ACK] Seq=1 Ack=37445 Win=65535 Len=0

Frame 455: 54 bytes on wire (432 bits), 54 bytes captured (432 bits) on interface en0, id 0
Ethernet II, Src: 52:0e:3d:58:d8:31 (52:0e:3d:58:d8:31), Dst: Espressif_95:b9:d0 (74:4d:bd:95:b9:d0)
Internet Protocol Version 4, Src: 192.168.1.123, Dst: 192.168.1.168
Transmission Control Protocol, Src Port: 65436, Dst Port: 8080, Seq: 1, Ack: 37445, Len: 0

No.     Time           Source                Destination           Protocol Length Info
    456 28.241864      192.168.1.168         192.168.1.123         TCP      1494   8080 → 65436 [ACK] Seq=37445 Ack=1 Win=5760 Len=1440

Frame 456: 1494 bytes on wire (11952 bits), 1494 bytes captured (11952 bits) on interface en0, id 0
Ethernet II, Src: Espressif_95:b9:d0 (74:4d:bd:95:b9:d0), Dst: 52:0e:3d:58:d8:31 (52:0e:3d:58:d8:31)
Internet Protocol Version 4, Src: 192.168.1.168, Dst: 192.168.1.123
Transmission Control Protocol, Src Port: 8080, Dst Port: 65436, Seq: 37445, Ack: 1, Len: 1440

No.     Time           Source                Destination           Protocol Length Info
    457 28.241967      192.168.1.123         192.168.1.168         TCP      54     65436 → 8080 [ACK] Seq=1 Ack=38885 Win=65535 Len=0

Frame 457: 54 bytes on wire (432 bits), 54 bytes captured (432 bits) on interface en0, id 0
Ethernet II, Src: 52:0e:3d:58:d8:31 (52:0e:3d:58:d8:31), Dst: Espressif_95:b9:d0 (74:4d:bd:95:b9:d0)
Internet Protocol Version 4, Src: 192.168.1.123, Dst: 192.168.1.168
Transmission Control Protocol, Src Port: 65436, Dst Port: 8080, Seq: 1, Ack: 38885, Len: 0

No.     Time           Source                Destination           Protocol Length Info
    458 28.245403      192.168.1.168         192.168.1.123         TCP      1494   8080 → 65436 [PSH, ACK] Seq=38885 Ack=1 Win=5760 Len=1440

Frame 458: 1494 bytes on wire (11952 bits), 1494 bytes captured (11952 bits) on interface en0, id 0
Ethernet II, Src: Espressif_95:b9:d0 (74:4d:bd:95:b9:d0), Dst: 52:0e:3d:58:d8:31 (52:0e:3d:58:d8:31)
Internet Protocol Version 4, Src: 192.168.1.168, Dst: 192.168.1.123
Transmission Control Protocol, Src Port: 8080, Dst Port: 65436, Seq: 38885, Ack: 1, Len: 1440

No.     Time           Source                Destination           Protocol Length Info
    459 28.245556      192.168.1.123         192.168.1.168         TCP      54     65436 → 8080 [ACK] Seq=1 Ack=40325 Win=65535 Len=0

Frame 459: 54 bytes on wire (432 bits), 54 bytes captured (432 bits) on interface en0, id 0
Ethernet II, Src: 52:0e:3d:58:d8:31 (52:0e:3d:58:d8:31), Dst: Espressif_95:b9:d0 (74:4d:bd:95:b9:d0)
Internet Protocol Version 4, Src: 192.168.1.123, Dst: 192.168.1.168
Transmission Control Protocol, Src Port: 65436, Dst Port: 8080, Seq: 1, Ack: 40325, Len: 0

No.     Time           Source                Destination           Protocol Length Info
    460 28.305078      192.168.1.168         192.168.1.123         TCP      1494   8080 → 65436 [ACK] Seq=40325 Ack=1 Win=5760 Len=1440

Frame 460: 1494 bytes on wire (11952 bits), 1494 bytes captured (11952 bits) on interface en0, id 0
Ethernet II, Src: Espressif_95:b9:d0 (74:4d:bd:95:b9:d0), Dst: 52:0e:3d:58:d8:31 (52:0e:3d:58:d8:31)
Internet Protocol Version 4, Src: 192.168.1.168, Dst: 192.168.1.123
Transmission Control Protocol, Src Port: 8080, Dst Port: 65436, Seq: 40325, Ack: 1, Len: 1440

No.     Time           Source                Destination           Protocol Length Info
    461 28.305243      192.168.1.123         192.168.1.168         TCP      54     65436 → 8080 [ACK] Seq=1 Ack=41765 Win=65535 Len=0

Frame 461: 54 bytes on wire (432 bits), 54 bytes captured (432 bits) on interface en0, id 0
Ethernet II, Src: 52:0e:3d:58:d8:31 (52:0e:3d:58:d8:31), Dst: Espressif_95:b9:d0 (74:4d:bd:95:b9:d0)
Internet Protocol Version 4, Src: 192.168.1.123, Dst: 192.168.1.168
Transmission Control Protocol, Src Port: 65436, Dst Port: 8080, Seq: 1, Ack: 41765, Len: 0

No.     Time           Source                Destination           Protocol Length Info
    464 28.407986      192.168.1.168         192.168.1.123         TCP      1494   8080 → 65436 [ACK] Seq=41765 Ack=1 Win=5760 Len=1440

Frame 464: 1494 bytes on wire (11952 bits), 1494 bytes captured (11952 bits) on interface en0, id 0
Ethernet II, Src: Espressif_95:b9:d0 (74:4d:bd:95:b9:d0), Dst: 52:0e:3d:58:d8:31 (52:0e:3d:58:d8:31)
Internet Protocol Version 4, Src: 192.168.1.168, Dst: 192.168.1.123
Transmission Control Protocol, Src Port: 8080, Dst Port: 65436, Seq: 41765, Ack: 1, Len: 1440

No.     Time           Source                Destination           Protocol Length Info
    465 28.408179      192.168.1.123         192.168.1.168         TCP      54     65436 → 8080 [ACK] Seq=1 Ack=43205 Win=65535 Len=0

Frame 465: 54 bytes on wire (432 bits), 54 bytes captured (432 bits) on interface en0, id 0
Ethernet II, Src: 52:0e:3d:58:d8:31 (52:0e:3d:58:d8:31), Dst: Espressif_95:b9:d0 (74:4d:bd:95:b9:d0)
Internet Protocol Version 4, Src: 192.168.1.123, Dst: 192.168.1.168
Transmission Control Protocol, Src Port: 65436, Dst Port: 8080, Seq: 1, Ack: 43205, Len: 0

No.     Time           Source                Destination           Protocol Length Info
    466 28.458734      192.168.1.168         192.168.1.123         TCP      1494   8080 → 65436 [PSH, ACK] Seq=43205 Ack=1 Win=5760 Len=1440

Frame 466: 1494 bytes on wire (11952 bits), 1494 bytes captured (11952 bits) on interface en0, id 0
Ethernet II, Src: Espressif_95:b9:d0 (74:4d:bd:95:b9:d0), Dst: 52:0e:3d:58:d8:31 (52:0e:3d:58:d8:31)
Internet Protocol Version 4, Src: 192.168.1.168, Dst: 192.168.1.123
Transmission Control Protocol, Src Port: 8080, Dst Port: 65436, Seq: 43205, Ack: 1, Len: 1440

No.     Time           Source                Destination           Protocol Length Info
    467 28.458941      192.168.1.123         192.168.1.168         TCP      54     65436 → 8080 [ACK] Seq=1 Ack=44645 Win=65535 Len=0

Frame 467: 54 bytes on wire (432 bits), 54 bytes captured (432 bits) on interface en0, id 0
Ethernet II, Src: 52:0e:3d:58:d8:31 (52:0e:3d:58:d8:31), Dst: Espressif_95:b9:d0 (74:4d:bd:95:b9:d0)
Internet Protocol Version 4, Src: 192.168.1.123, Dst: 192.168.1.168
Transmission Control Protocol, Src Port: 65436, Dst Port: 8080, Seq: 1, Ack: 44645, Len: 0

No.     Time           Source                Destination           Protocol Length Info
    472 28.495445      192.168.1.168         192.168.1.123         TCP      1494   8080 → 65436 [ACK] Seq=44645 Ack=1 Win=5760 Len=1440

Frame 472: 1494 bytes on wire (11952 bits), 1494 bytes captured (11952 bits) on interface en0, id 0
Ethernet II, Src: Espressif_95:b9:d0 (74:4d:bd:95:b9:d0), Dst: 52:0e:3d:58:d8:31 (52:0e:3d:58:d8:31)
Internet Protocol Version 4, Src: 192.168.1.168, Dst: 192.168.1.123
Transmission Control Protocol, Src Port: 8080, Dst Port: 65436, Seq: 44645, Ack: 1, Len: 1440

No.     Time           Source                Destination           Protocol Length Info
    473 28.495636      192.168.1.123         192.168.1.168         TCP      54     65436 → 8080 [ACK] Seq=1 Ack=46085 Win=65535 Len=0

Frame 473: 54 bytes on wire (432 bits), 54 bytes captured (432 bits) on interface en0, id 0
Ethernet II, Src: 52:0e:3d:58:d8:31 (52:0e:3d:58:d8:31), Dst: Espressif_95:b9:d0 (74:4d:bd:95:b9:d0)
Internet Protocol Version 4, Src: 192.168.1.123, Dst: 192.168.1.168
Transmission Control Protocol, Src Port: 65436, Dst Port: 8080, Seq: 1, Ack: 46085, Len: 0

No.     Time           Source                Destination           Protocol Length Info
    474 28.609567      192.168.1.168         192.168.1.123         TCP      1494   8080 → 65436 [PSH, ACK] Seq=46085 Ack=1 Win=5760 Len=1440

Frame 474: 1494 bytes on wire (11952 bits), 1494 bytes captured (11952 bits) on interface en0, id 0
Ethernet II, Src: Espressif_95:b9:d0 (74:4d:bd:95:b9:d0), Dst: 52:0e:3d:58:d8:31 (52:0e:3d:58:d8:31)
Internet Protocol Version 4, Src: 192.168.1.168, Dst: 192.168.1.123
Transmission Control Protocol, Src Port: 8080, Dst Port: 65436, Seq: 46085, Ack: 1, Len: 1440

No.     Time           Source                Destination           Protocol Length Info
    475 28.609747      192.168.1.123         192.168.1.168         TCP      54     65436 → 8080 [ACK] Seq=1 Ack=47525 Win=65535 Len=0

Frame 475: 54 bytes on wire (432 bits), 54 bytes captured (432 bits) on interface en0, id 0
Ethernet II, Src: 52:0e:3d:58:d8:31 (52:0e:3d:58:d8:31), Dst: Espressif_95:b9:d0 (74:4d:bd:95:b9:d0)
Internet Protocol Version 4, Src: 192.168.1.123, Dst: 192.168.1.168
Transmission Control Protocol, Src Port: 65436, Dst Port: 8080, Seq: 1, Ack: 47525, Len: 0

No.     Time           Source                Destination           Protocol Length Info
